A1: voltar Datamace Informática LTDA - Todos os diretos reservados

B1: Intranet DATAMACE | C1: var diasemana = new Array; var mesescrito = new Array; diasemana[1] = "Segunda-feira"; diasemana[2] = "Terça-feira"; diasemana[3] = "Quarta-feira"; diasemana[4] = "Quinta-feira"; diasemana[5] = "Sexta-feira"; diasemana[6] = "Sábado"; diasemana[0] = "Domingo"; mesescrito[0] = "Janeiro"; mesescrito[1] = "Fevereiro"; mesescrito[2] = "Março"; mesescrito[3] = "Abril"; mesescrito[4] = "Maio"; mesescrito[5] = "Junho"; mesescrito[6] = "Julho"; mesescrito[7] = "Agosto"; mesescrito[8] = "Setembro"; mesescrito[9] = "Outubro"; mesescrito[10] = "Novembro"; mesescrito[11] = "Dezembro"; var datahoje = new Date(); var dia; var mes; var ano; var diaindex; dia = datahoje.getDate(); mes = datahoje.getMonth(); ano = datahoje.getYear(); diaindex = datahoje.getDay(); document.write (diasemana[diaindex] + '<br>' + dia + ' de ' + mesescrito[mes] + ' de ' + ano);

A1: Qualidade Total : Tabulação

A4: PRODUTOS | B4: N.U. | C4: 1 | D4: 2 | E4: 3 | F4: 4 | H4: 1 | I4: 2 | J4: 3 | K4: 4 | L4: =SUM(C1:K1) -> 20 | M4: negativa | N4: positiva
A5: GIP | B5: 4 | C5: 1 | D5: 2 | E5: 68 | F5: 71 | G5: =SUM(B2:F2) -> 146 | H5: 0 | I5: 0 | J5: 25 | K5: 116 | L5: =B2+H2+I2+J2+K2 -> 145 | M5: =C2+D2 -> 3 | N5: =E2+F2 -> 139
A6: PONTO | B6: 87 | C6: 1 | D6: 9 | E6: 34 | F6: 15 | G6: =SUM(B3:F3) -> 146 | H6: 1 | I6: 0 | J6: 20 | K6: 38 | L6: =B3+H3+I3+J3+K3 -> 146 | M6: =C3+D3 -> 10 | N6: =E3+F3 -> 49
A7: RH GERENCIAL | B7: 133 | C7: 3 | D7: 2 | E7: 6 | F7: 2 | G7: =SUM(B4:F4) -> 146 | H7: 0 | I7: 2 | J7: 3 | K7: 8 | L7: =B4+H4+I4+J4+K4 -> 146 | M7: =C4+D4 -> 5 | N7: =E4+F4 -> 8
A8: RH AVANÇADO | B8: 142 | C8: 0 | D8: 1 | E8: 3 | F8: 0 | G8: =SUM(B5:F5) -> 146 | H8: 0 | I8: 0 | J8: 1 | K8: 3 | L8: =B5+H5+I5+J5+K5 -> 146 | M8: =C5+D5 -> 1 | N8: =E5+F5 -> 3
A9: ATIVO FIXO | B9: 142 | C9: 2 | D9: 2 | E9: 0 | F9: 0 | G9: =SUM(B6:F6) -> 146 | H9: 0 | I9: 1 | J9: 0 | K9: 3 | L9: =B6+H6+I6+J6+K6 -> 146 | M9: =C6+D6 -> 4 | N9: =E6+F6 -> 0
A10: CONTABILIDADE | B10: 134 | C10: 2 | D10: 6 | E10: 4 | F10: 0 | G10: =SUM(B7:F7) -> 146 | H10: 0 | I10: 1 | J10: 3 | K10: 8 | L10: =B7+H7+I7+J7+K7 -> 146 | M10: =C7+D7 -> 8 | N10: =E7+F7 -> 4
A11: LIVROS FISCAIS | B11: 138 | C11: 0 | D11: 2 | E11: 4 | F11: 2 | G11: =SUM(B8:F8) -> 146 | H11: 0 | I11: 0 | J11: 4 | K11: 4 | L11: =B8+H8+I8+J8+K8 -> 146 | M11: =C8+D8 -> 2 | N11: =E8+F8 -> 6
A12: FAC.NO APRENDIZADO? | C12: 1 | D12: 5 | E12: 87 | F12: 53 | G12: =SUM(B9:F9) -> 146 | H12: 1 | I12: 3 | J12: 55 | K12: 87 | L12: =B9+H9+I9+J9+K9 -> 146 | M12: =C9+D9 -> 6 | N12: =E9+F9 -> 140
A13: FACILIDADE NO USO? | C13: 4 | D13: 3 | E13: 66 | F13: 73 | G13: =SUM(B10:F10) -> 146 | H13: 4 | I13: 1 | J13: 42 | K13: 99 | L13: =B10+H10+I10+J10+K10 -> 146 | M13: =C10+D10 -> 7 | N13: =E10+F10 -> 139
A14: VISUAL DAS TELAS | B14: 1 | C14: 3 | D14: 6 | E14: 61 | F14: 75 | G14: =SUM(B11:F11) -> 146 | H14: 2 | I14: 3 | J14: 44 | K14: 96 | L14: =B11+H11+I11+J11+K11 -> 146 | M14: =C11+D11 -> 9 | N14: =E11+F11 -> 136
A15: RELATÓRIOS | B15: 1 | C15: 1 | D15: 17 | E15: 64 | F15: 63 | G15: =SUM(B12:F12) -> 146 | H15: 1 | I15: 5 | J15: 44 | K15: 95 | L15: =B12+H12+I12+J12+K12 -> 146 | M15: =C12+D12 -> 18 | N15: =E12+F12 -> 127
A16: PERFORMANCE | B16: 1 | C16: 2 | D16: 2 | E16: 57 | F16: 84 | G16: =SUM(B13:F13) -> 146 | H16: 2 | I16: 2 | J16: 35 | K16: 106 | L16: =B13+H13+I13+J13+K13 -> 146 | M16: =C13+D13 -> 4 | N16: =E13+F13 -> 141
A17: SEGURANÇA | B17: 1 | C17: 3 | D17: 4 | E17: 56 | F17: 82 | G17: =SUM(B14:F14) -> 146 | H17: 2 | I17: 0 | J17: 29 | K17: 114 | L17: =B14+H14+I14+J14+K14 -> 146 | M17: =C14+D14 -> 7 | N17: =E14+F14 -> 138
A18: EFICIENCIA | B18: 1 | C18: 1 | D18: 10 | E18: 56 | F18: 78 | G18: =SUM(B15:F15) -> 146 | H18: 1 | I18: 1 | J18: 30 | K18: 113 | L18: =B15+H15+I15+J15+K15 -> 146 | M18: =C15+D15 -> 11 | N18: =E15+F15 -> 134
A19: ATEND.DAS NECESSIDADES | B19: 1 | C19: 1 | D19: 14 | E19: 70 | F19: 60 | G19: =SUM(B16:F16) -> 146 | H19: 1 | I19: 1 | J19: 40 | K19: 103 | L19: =B16+H16+I16+J16+K16 -> 146 | M19: =C16+D16 -> 15 | N19: =E16+F16 -> 130
A20: HELP ON LINE | B20: 34 | C20: 12 | D20: 20 | E20: 52 | F20: 28 | G20: =SUM(B17:F17) -> 146 | H20: 3 | I20: 4 | J20: 47 | K20: 58 | L20: =B17+H17+I17+J17+K17 -> 146 | M20: =C17+D17 -> 32 | N20: =E17+F17 -> 80
A21: BOLETIM ON SITE | B21: 58 | C21: 4 | D21: 12 | E21: 53 | F21: 19 | G21: =SUM(B18:F18) -> 146 | H21: 2 | I21: 2 | J21: 48 | K21: 36 | L21: =B18+H18+I18+J18+K18 -> 146 | M21: =C18+D18 -> 16 | N21: =E18+F18 -> 72
A22: BOLETIM DE NOVAS VERSÕES | B22: 8 | C22: 4 | D22: 11 | E22: 72 | F22: 51 | G22: =SUM(B19:F19) -> 146 | H22: 1 | I22: 6 | J22: 52 | K22: 79 | L22: =B19+H19+I19+J19+K19 -> 146 | M22: =C19+D19 -> 15 | N22: =E19+F19 -> 123
A23: MANUAL DO USUÁRIO | B23: 31 | C23: 11 | D23: 19 | E23: 59 | F23: 26 | G23: =SUM(B20:F20) -> 146 | H23: 1 | I23: 6 | J23: 38 | K23: 70 | L23: =B20+H20+I20+J20+K20 -> 146 | M23: =C20+D20 -> 30 | N23: =E20+F20 -> 85
A25: WEB SITE | B25: N.U. | C25: 1 | D25: 2 | E25: 3 | F25: 4 | H25: 1 | I25: 2 | J25: 3 | K25: 4
A26: DESIGN DO SITE | B26: 60 | C26: 1 | D26: 1 | E26: 54 | F26: 30 | G26: =SUM(B22:F22) -> 146 | H26: 1 | I26: 3 | J26: 46 | K26: 36 | L26: =B22+H22+I22+J22+K22 -> 146 | M26: =C22+D22 -> 2 | N26: =E22+F22 -> 84
A27: FACILIDADE DE NAVEGAÇÃO | B27: 59 | C27: 1 | D27: 1 | E27: 50 | F27: 35 | G27: =SUM(B23:F23) -> 146 | H27: 1 | I27: 2 | J27: 36 | K27: 48 | L27: =B23+H23+I23+J23+K23 -> 146 | M27: =C23+D23 -> 2 | N27: =E23+F23 -> 85
A28: TEMPO DE ESPERA P/ SENHA | B28: 60 | C28: 3 | D28: 7 | E28: 50 | F28: 26 | G28: =SUM(B24:F24) -> 146 | H28: 2 | I28: 3 | J28: 33 | K28: 48 | L28: =B24+H24+I24+J24+K24 -> 146 | M28: =C24+D24 -> 10 | N28: =E24+F24 -> 76
A29: TEMPO DE RETORNO DE E-MAIL | B29: 59 | C29: 9 | D29: 18 | E29: 48 | F29: 12 | G29: =SUM(B25:F25) -> 146 | H29: 1 | I29: 3 | J29: 26 | K29: 57 | L29: =B25+H25+I25+J25+K25 -> 146 | M29: =C25+D25 -> 27 | N29: =E25+F25 -> 60
A30: SATISF.COM OS SERVS. P/ INTERNET | B30: 57 | C30: 1 | D30: 12 | E30: 58 | F30: 18 | G30: =SUM(B26:F26) -> 146 | H30: 2 | I30: 2 | J30: 32 | K30: 53 | L30: =B26+H26+I26+J26+K26 -> 146 | M30: =C26+D26 -> 13 | N30: =E26+F26 -> 76
A31: MÉDIA WEB SITE | C31: =AVERAGE(C22:C26) -> 3 | D31: =AVERAGE(D22:D26) -> 7.8 | E31: =AVERAGE(E22:E26) -> 52 | F31: =AVERAGE(F22:F26) -> 24.2 | H31: =AVERAGE(H22:H26) -> 1.4 | I31: =AVERAGE(I22:I26) -> 2.6 | J31: =AVERAGE(J22:J26) -> 34.6 | K31: =AVERAGE(K22:K26) -> 48.4 | M31: =AVERAGE(M22:M26) -> 10.8 | N31: =AVERAGE(N22:N26) -> 76.2
A33: ATENDIMENTO DE RECEPÇÃO | B33: N.U. | C33: 1 | D33: 2 | E33: 3 | F33: 4 | H33: 1 | I33: 2 | J33: 3 | K33: 4
A34: CORTESIA E PROFISSIONALISMO | B34: 16 | C34: 2 | D34: 8 | E34: 55 | F34: 65 | G34: =SUM(B37:F37) -> 146 | H34: 1 | I34: 7 | J34: 44 | K34: 78 | L34: =B37+H37+I37+J37+K37 -> 146 | M34: =C37+D37 -> 10 | N34: =E37+F37 -> 120
A35: PERSONALIZAÇÃO NO TRATAMENTO | B35: 16 | C35: 3 | D35: 7 | E35: 66 | F35: 54 | G35: =SUM(B38:F38) -> 146 | H35: 2 | I35: 8 | J35: 47 | K35: 73 | L35: =B38+H38+I38+J38+K38 -> 146 | M35: =C38+D38 -> 10 | N35: =E38+F38 -> 120
A36: EFICIENCIA | B36: 15 | C36: 3 | D36: 6 | E36: 66 | F36: 56 | G36: =SUM(B39:F39) -> 146 | H36: 1 | I36: 5 | J36: 42 | K36: 83 | L36: =B39+H39+I39+J39+K39 -> 146 | M36: =C39+D39 -> 9 | N36: =E39+F39 -> 122
A37: MÉDIA ATEND.RECEPÇÃO | C37: =AVERAGE(C37:C39) -> 2.6666666666666665 | D37: =AVERAGE(D37:D39) -> 7 | E37: =AVERAGE(E37:E39) -> 62.333333333333336 | F37: =AVERAGE(F37:F39) -> 58.333333333333336 | H37: =AVERAGE(H37:H39) -> 1.3333333333333333 | I37: =AVERAGE(I37:I39) -> 6.666666666666667 | J37: =AVERAGE(J37:J39) -> 44.333333333333336 | K37: =AVERAGE(K37:K39) -> 78 | M37: =AVERAGE(M37:M39) -> 9.6666666666666661 | N37: =AVERAGE(N37:N39) -> 120.66666666666667
A39: ATENDIMENTO DE MARKETING | B39: N.U. | C39: 1 | D39: 2 | E39: 3 | F39: 4 | H39: 1 | I39: 2 | J39: 3 | K39: 4
A40: DIVULGAÇÃO DE PRODS. E SERVS. | B40: 69 | C40: 4 | D40: 12 | E40: 47 | F40: 14 | G40: =SUM(B42:F42) -> 146 | H40: 0 | I40: 5 | J40: 39 | K40: 33 | L40: =B42+H42+I42+J42+K42 -> 146 | M40: =C42+D42 -> 16 | N40: =E42+F42 -> 61
A41: T.ESPERA NOS C.TELEFONICOS | B41: 74 | C41: 7 | D41: 16 | E41: 41 | F41: 8 | G41: =SUM(B43:F43) -> 146 | H41: 0 | I41: 5 | J41: 27 | K41: 40 | L41: =B43+H43+I43+J43+K43 -> 146 | M41: =C43+D43 -> 23 | N41: =E43+F43 -> 49
A42: T.RETORNO DE FAX E E-MAILS | B42: 79 | C42: 4 | D42: 17 | E42: 35 | F42: 11 | G42: =SUM(B44:F44) -> 146 | H42: 0 | I42: 2 | J42: 30 | K42: 35 | L42: =B44+H44+I44+J44+K44 -> 146 | M42: =C44+D44 -> 21 | N42: =E44+F44 -> 46
A43: APRES.DE PRODS. E SERVS. C /OBJETIVIDADE | B43: 81 | C43: 2 | D43: 4 | E43: 41 | F43: 18 | G43: =SUM(B45:F45) -> 146 | H43: 0 | I43: 2 | J43: 30 | K43: 33 | L43: =B45+H45+I45+J45+K45 -> 146 | M43: =C45+D45 -> 6 | N43: =E45+F45 -> 59
A44: CLAREZA E OBJET. NAS PROPOSTAS | B44: 82 | C44: 1 | D44: 4 | E44: 38 | F44: 21 | G44: =SUM(B46:F46) -> 146 | H44: 0 | I44: 2 | J44: 30 | K44: 32 | L44: =B46+H46+I46+J46+K46 -> 146 | M44: =C46+D46 -> 5 | N44: =E46+F46 -> 59
A45: CORTESIA E PROFISSIONALISMO | B45: 79 | C45: 0 | D45: 2 | E45: 40 | F45: 25 | G45: =SUM(B47:F47) -> 146 | H45: 0 | I45: 1 | J45: 28 | K45: 38 | L45: =B47+H47+I47+J47+K47 -> 146 | M45: =C47+D47 -> 2 | N45: =E47+F47 -> 65
A46: EFICIENCIA E CONHECIMENTO | B46: 75 | C46: 0 | D46: 4 | E46: 42 | F46: 25 | G46: =SUM(B48:F48) -> 146 | H46: 0 | I46: 0 | J46: 21 | K46: 50 | L46: =B48+H48+I48+J48+K48 -> 146 | M46: =C48+D48 -> 4 | N46: =E48+F48 -> 67
A47: PERSONALIZAÇÃO NO TRATAMENTO | B47: 78 | C47: 0 | D47: 6 | E47: 41 | F47: 21 | G47: =SUM(B49:F49) -> 146 | H47: 0 | I47: 2 | J47: 28 | K47: 38 | L47: =B49+H49+I49+J49+K49 -> 146 | M47: =C49+D49 -> 6 | N47: =E49+F49 -> 62
A48: PREÇO PRATICADO x MERCADO | B48: 78 | C48: 2 | D48: 3 | E48: 48 | F48: 15 | G48: =SUM(B50:F50) -> 146 | H48: 0 | I48: 1 | J48: 31 | K48: 36 | L48: =B50+H50+I50+J50+K50 -> 146 | M48: =C50+D50 -> 5 | N48: =E50+F50 -> 63
A49: FLEX.NAS NEGOCIAÇÕES E PAGTO | B49: 78 | C49: 0 | E49: 46 | F49: 22 | G49: =SUM(B51:F51) -> 146 | H49: 0 | J49: 28 | K49: 40 | L49: =B51+H51+I51+J51+K51 -> 146 | M49: =C51+D51 -> 0 | N49: =E51+F51 -> 68
A50: CONTATO PÓS-VENDA | B50: 81 | C50: 8 | D50: 7 | E50: 32 | F50: 18 | G50: =SUM(B52:F52) -> 146 | H50: 0 | I50: 2 | J50: 23 | K50: 40 | L50: =B52+H52+I52+J52+K52 -> 146 | M50: =C52+D52 -> 15 | N50: =E52+F52 -> 50
A51: MÉDIA ATEND.DE MARKETING | C51: =AVERAGE(C42:C52) -> 2.5454545454545454 | D51: =AVERAGE(D42:D52) -> 7.5 | E51: =AVERAGE(E42:E52) -> 41 | F51: =AVERAGE(F42:F52) -> 18 | H51: 0 | I51: =AVERAGE(I42:I52) -> 2.2 | J51: =AVERAGE(J42:J52) -> 28.636363636363637 | K51: =AVERAGE(K42:K52) -> 37.727272727272727 | M51: =AVERAGE(M42:M52) -> 9.3636363636363633 | N51: =AVERAGE(N42:N52) -> 59
A53: CONSULTORES INTERNOS | B53: N.U. | C53: 1 | D53: 2 | E53: 3 | F53: 4 | H53: 1 | I53: 2 | J53: 3 | K53: 4
A54: T.ESPERA NOS CONTATOS TELEFONICOS | B54: 6 | C54: 36 | D54: 48 | E54: 45 | F54: 11 | G54: =SUM(B55:F55) -> 146 | H54: 7 | I54: 12 | J54: 30 | K54: 91 | L54: =B55+H55+I55+J55+K55 -> 146 | M54: =C55+D55 -> 84 | N54: =E55+F55 -> 56
A55: T.RETORNO DE FAX E E-MAILS | B55: 16 | C55: 16 | D55: 42 | E55: 53 | F55: 19 | G55: =SUM(B56:F56) -> 146 | H55: 4 | I55: 8 | J55: 36 | K55: 82 | L55: =B56+H56+I56+J56+K56 -> 146 | M55: =C56+D56 -> 58 | N55: =E56+F56 -> 72
A56: T.RETORNO NAS LIGAÇÕES SPEED | B56: 68 | C56: 5 | D56: 18 | E56: 40 | F56: 15 | G56: =SUM(B57:F57) -> 146 | H56: 0 | I56: 8 | J56: 27 | K56: 43 | L56: =B57+H57+I57+J57+K57 -> 146 | M56: =C57+D57 -> 23 | N56: =E57+F57 -> 55
A57: CORTESIA E PROFISSIONALISMO | B57: 9 | C57: 2 | D57: 3 | E57: 76 | F57: 56 | G57: =SUM(B58:F58) -> 146 | H57: 1 | I57: 0 | J57: 45 | K57: 91 | L57: =B58+H58+I58+J58+K58 -> 146 | M57: =C58+D58 -> 5 | N57: =E58+F58 -> 132
A58: EFICIENCIA E EFICACIA RES.PROBLEMAS | B58: 8 | C58: 1 | D58: 18 | E58: 74 | F58: 45 | G58: =SUM(B59:F59) -> 146 | H58: 0 | I58: 7 | J58: 32 | K58: 99 | L58: =B59+H59+I59+J59+K59 -> 146 | M58: =C59+D59 -> 19 | N58: =E59+F59 -> 119
A59: RECEPTIVIDADE | B59: 8 | C59: 2 | D59: 7 | E59: 76 | F59: 53 | G59: =SUM(B60:F60) -> 146 | H59: 1 | I59: 2 | J59: 54 | K59: 81 | L59: =B60+H60+I60+J60+K60 -> 146 | M59: =C60+D60 -> 9 | N59: =E60+F60 -> 129
A60: CONFIABILIDADE E EXATIDÃO | B60: 7 | C60: 3 | D60: 8 | E60: 79 | F60: 49 | G60: =SUM(B61:F61) -> 146 | H60: 1 | I60: 2 | J60: 40 | K60: 96 | L60: =B61+H61+I61+J61+K61 -> 146 | M60: =C61+D61 -> 11 | N60: =E61+F61 -> 128
A61: CONHECIMENTO DOS PRODUTOS | B61: 7 | C61: 3 | D61: 10 | E61: 65 | F61: 61 | G61: =SUM(B62:F62) -> 146 | H61: 1 | I61: 2 | J61: 36 | K61: 100 | L61: =B62+H62+I62+J62+K62 -> 146 | M61: =C62+D62 -> 13 | N61: =E62+F62 -> 126
A62: PERSONALIZAÇÃO NO TRATAMENTO | B62: 7 | C62: 5 | D62: 8 | E62: 78 | F62: 48 | G62: =SUM(B63:F63) -> 146 | H62: 2 | I62: 2 | J62: 51 | K62: 84 | L62: =B63+H63+I63+J63+K63 -> 146 | M62: =C63+D63 -> 13 | N62: =E63+F63 -> 126
A63: MÉDIA SUPORTE CONS.INTERNOS | C63: =AVERAGE(C55:C63) -> 8.1111111111111107 | D63: =AVERAGE(D55:D63) -> 18 | E63: =AVERAGE(E55:E63) -> 65.111111111111114 | F63: =AVERAGE(F55:F63) -> 39.666666666666664 | H63: =AVERAGE(H55:H63) -> 1.8888888888888888 | I63: =AVERAGE(I55:I63) -> 4.7777777777777777 | J63: =AVERAGE(J55:J63) -> 39 | K63: =AVERAGE(K55:K63) -> 85.222222222222229 | M63: =AVERAGE(M55:M63) -> 26.111111111111111 | N63: =AVERAGE(N55:N63) -> 104.77777777777777
A65: CONSULTORES EXTERNOS | B65: N.U. | C65: 1 | D65: 2 | E65: 3 | F65: 4 | H65: 1 | I65: 2 | J65: 3 | K65: 4
A66: VISITAS PERIODICAS / ATEND. PLUS | B66: 121 | C66: 3 | D66: 12 | E66: 5 | F66: 5 | G66: =SUM(B66:F66) -> 146 | H66: 0 | I66: 2 | J66: 9 | K66: 14 | L66: =B66+H66+I66+J66+K66 -> 146 | M66: =C66+D66 -> 15 | N66: =E66+F66 -> 10
A67: VISITAS AVULSAS | B67: 120 | C67: 3 | D67: 11 | E67: 7 | F67: 5 | G67: =SUM(B67:F67) -> 146 | H67: 1 | I67: 3 | J67: 8 | K67: 14 | L67: =B67+H67+I67+J67+K67 -> 146 | M67: =C67+D67 -> 14 | N67: =E67+F67 -> 12
A68: TREINAMENTO NO CLIENTE | B68: 109 | C68: 3 | D68: 5 | E68: 17 | F68: 12 | G68: =SUM(B68:F68) -> 146 | H68: 0 | I68: 0 | J68: 9 | K68: 28 | L68: =B68+H68+I68+J68+K68 -> 146 | M68: =C68+D68 -> 8 | N68: =E68+F68 -> 29
A69: TERCEIRIZAÇÃO DE SERVIÇOS | B69: 136 | D69: 3 | E69: 5 | F69: 2 | G69: =SUM(B69:F69) -> 146 | H69: 0 | I69: 0 | J69: 4 | K69: 8 | L69: =B69+H69+I69+J69+K69 -> 148 | M69: =C69+D69 -> 3 | N69: =E69+F69 -> 7
A70: T.ESPERA NOS CONTATOS TELEFONICOS | B70: 117 | C70: 2 | D70: 7 | E70: 15 | F70: 5 | G70: =SUM(B70:F70) -> 146 | H70: 0 | I70: 0 | J70: 10 | K70: 19 | L70: =B70+H70+I70+J70+K70 -> 146 | M70: =C70+D70 -> 9 | N70: =E70+F70 -> 20
A71: T.RETORNO DE FAX OU E-MAILS | B71: 118 | C71: 3 | D71: 3 | E71: 17 | F71: 5 | G71: =SUM(B71:F71) -> 146 | H71: 0 | I71: 0 | J71: 11 | K71: 17 | L71: =B71+H71+I71+J71+K71 -> 146 | M71: =C71+D71 -> 6 | N71: =E71+F71 -> 22
A72: CORTESIA E PROFISSIONALISMO | B72: 115 | C72: 1 | D72: 1 | E72: 19 | F72: 10 | G72: =SUM(B72:F72) -> 146 | H72: 0 | I72: 0 | J72: 10 | K72: 21 | L72: =B72+H72+I72+J72+K72 -> 146 | M72: =C72+D72 -> 2 | N72: =E72+F72 -> 29
A73: EFICIENCIA E EFICACIA NA RES. PROBL. | B73: 111 | C73: 2 | D73: 2 | E73: 21 | F73: 10 | G73: =SUM(B73:F73) -> 146 | H73: 0 | I73: 4 | J73: 7 | K73: 24 | L73: =B73+H73+I73+J73+K73 -> 146 | M73: =C73+D73 -> 4 | N73: =E73+F73 -> 31
A74: CONFIABILIDADE E EXATIDÃO | B74: 113 | C74: 1 | D74: 2 | E74: 20 | F74: 10 | G74: =SUM(B74:F74) -> 146 | H74: 0 | I74: 0 | J74: 10 | K74: 23 | L74: =B74+H74+I74+J74+K74 -> 146 | M74: =C74+D74 -> 3 | N74: =E74+F74 -> 30
A75: CONHECIMENTO DOS PRODUTOS | B75: 114 | C75: 1 | D75: 4 | E75: 16 | F75: 11 | G75: =SUM(B75:F75) -> 146 | H75: 0 | I75: 1 | J75: 9 | K75: 22 | L75: =B75+H75+I75+J75+K75 -> 146 | M75: =C75+D75 -> 5 | N75: =E75+F75 -> 27
A76: PERSONALIZAÇÃO NO TRATAMENTO | B76: 115 | D76: 3 | E76: 19 | F76: 9 | G76: =SUM(B76:F76) -> 146 | H76: 0 | I76: 0 | J76: 12 | K76: 19 | L76: =B76+H76+I76+J76+K76 -> 146 | M76: =C76+D76 -> 3 | N76: =E76+F76 -> 28
A77: PREÇO PRATICADO x MERCADO | B77: 115 | C77: 1 | D77: 5 | E77: 19 | F77: 6 | G77: =SUM(B77:F77) -> 146 | H77: 0 | I77: 2 | J77: 11 | K77: 18 | L77: =B77+H77+I77+J77+K77 -> 146 | M77: =C77+D77 -> 6 | N77: =E77+F77 -> 25
A78: FLEX. NAS NEGOCIAÇÕES E PAGTO. | B78: 115 | C78: 1 | D78: 1 | E78: 22 | F78: 7 | G78: =SUM(B78:F78) -> 146 | H78: 0 | I78: 2 | J78: 11 | K78: 18 | L78: =B78+H78+I78+J78+K78 -> 146 | M78: =C78+D78 -> 2 | N78: =E78+F78 -> 29
A79: DISPON.DE CONSULTOR | B79: 117 | C79: 3 | D79: 6 | E79: 13 | F79: 7 | G79: =SUM(B79:F79) -> 146 | H79: 1 | I79: 0 | J79: 7 | K79: 21 | L79: =B79+H79+I79+J79+K79 -> 146 | M79: =C79+D79 -> 9 | N79: =E79+F79 -> 20
A80: MÉDIA SUPORTE CONS. EXTERNOS | C80: =AVERAGE(C66:C79) -> 2 | D80: =AVERAGE(D66:D79) -> 4.6428571428571432 | E80: =AVERAGE(E66:E79) -> 15.357142857142858 | F80: =AVERAGE(F66:F79) -> 7.4285714285714288 | H80: =AVERAGE(H66:H79) -> 0.14285714285714285 | I80: =AVERAGE(I66:I79) -> 1 | J80: =AVERAGE(J66:J79) -> 9.1428571428571423 | K80: =AVERAGE(K66:K79) -> 19 | M80: =AVERAGE(M66:M79) -> 6.3571428571428568 | N80: =AVERAGE(N66:N79) -> 22.785714285714285
A82: TREINAMENTO | B82: N.U. | C82: 1 | D82: 2 | E82: 3 | F82: 4 | H82: 1 | I82: 2 | J82: 3 | K82: 4
A83: ATEND.P/AGEND.DE TREINAMENTO | B83: 61 | C83: 1 | D83: 3 | E83: 49 | F83: 32 | G83: =SUM(B82:F82) -> 146 | H83: 0 | I83: 1 | J83: 27 | K83: 57 | L83: =B82+H82+I82+J82+K82 -> 146 | M83: =C82+D82 -> 4 | N83: =E82+F82 -> 81
A84: DIVULG.DAS PROGRAMAÇÕES | B84: 62 | C84: 8 | D84: 14 | E84: 42 | F84: 20 | G84: =SUM(B83:F83) -> 146 | H84: 0 | I84: 4 | J84: 30 | K84: 50 | L84: =B83+H83+I83+J83+K83 -> 146 | M84: =C83+D83 -> 22 | N84: =E83+F83 -> 62
A85: DISPONIBILIDADE DE DATAS | B85: 60 | C85: 2 | D85: 9 | E85: 54 | F85: 21 | G85: =SUM(B84:F84) -> 146 | H85: 0 | I85: 3 | J85: 41 | K85: 42 | L85: =B84+H84+I84+J84+K84 -> 146 | M85: =C84+D84 -> 11 | N85: =E84+F84 -> 75
A86: TEMPO DE DURAÇÃO DOS CURSOS | B86: 63 | C86: 2 | D86: 9 | E86: 48 | F86: 24 | G86: =SUM(B85:F85) -> 146 | H86: 0 | I86: 1 | J86: 34 | K86: 48 | L86: =B85+H85+I85+J85+K85 -> 146 | M86: =C85+D85 -> 11 | N86: =E85+F85 -> 72
A87: T.DE ESPERA NO TELEFONE | B87: 64 | C87: 5 | D87: 12 | E87: 47 | F87: 18 | G87: =SUM(B86:F86) -> 146 | H87: 0 | I87: 0 | J87: 33 | K87: 49 | L87: =B86+H86+I86+J86+K86 -> 146 | M87: =C86+D86 -> 17 | N87: =E86+F86 -> 65
A88: T.DE RETORNO DE FAX E E-MAILS | B88: 72 | C88: 4 | D88: 8 | E88: 43 | F88: 19 | G88: =SUM(B87:F87) -> 146 | H88: 0 | I88: 0 | J88: 30 | K88: 44 | L88: =B87+H87+I87+J87+K87 -> 146 | M88: =C87+D87 -> 12 | N88: =E87+F87 -> 62
A89: EFICIENCIA DOS INSTRUTORES | B89: 61 | C89: 1 | D89: 2 | E89: 40 | F89: 42 | G89: =SUM(B88:F88) -> 146 | H89: 0 | I89: 0 | J89: 19 | K89: 66 | L89: =B88+H88+I88+J88+K88 -> 146 | M89: =C88+D88 -> 3 | N89: =E88+F88 -> 82
A90: CONFIABILIDADE E EXATIDÃO | B90: 60 | C90: 1 | D90: 3 | E90: 39 | F90: 43 | G90: =SUM(B89:F89) -> 146 | H90: 0 | I90: 0 | J90: 19 | K90: 67 | L90: =B89+H89+I89+J89+K89 -> 146 | M90: =C89+D89 -> 4 | N90: =E89+F89 -> 82
A91: CONHECIMENTO DOS PRODUTOS | B91: 61 | C91: 1 | D91: 2 | E91: 37 | F91: 45 | G91: =SUM(B90:F90) -> 146 | H91: 0 | I91: 0 | J91: 20 | K91: 65 | L91: =B90+H90+I90+J90+K90 -> 146 | M91: =C90+D90 -> 3 | N91: =E90+F90 -> 82
A92: MATERIAL DIDATICO | B92: 63 | C92: 3 | D92: 5 | E92: 45 | F92: 30 | G92: =SUM(B91:F91) -> 146 | H92: 0 | I92: 0 | J92: 32 | K92: 51 | L92: =B91+H91+I91+J91+K91 -> 146 | M92: =C91+D91 -> 8 | N92: =E91+F91 -> 75
A93: SALA DE TREINAMENTO | B93: 61 | C93: 2 | D93: 2 | E93: 54 | F93: 27 | G93: =SUM(B92:F92) -> 146 | H93: 0 | I93: 2 | J93: 38 | K93: 45 | L93: =B92+H92+I92+J92+K92 -> 146 | M93: =C92+D92 -> 4 | N93: =E92+F92 -> 81
A94: EQUIPAMENTOS UTILIZADOS | B94: 61 | C94: 2 | D94: 2 | E94: 54 | F94: 27 | G94: =SUM(B93:F93) -> 146 | H94: 0 | I94: 0 | J94: 40 | K94: 45 | L94: =B93+H93+I93+J93+K93 -> 146 | M94: =C93+D93 -> 4 | N94: =E93+F93 -> 81
A95: EFICIENCIA E EFICACIA | B95: 60 | C95: 1 | D95: 4 | E95: 47 | F95: 34 | G95: =SUM(B94:F94) -> 146 | H95: 0 | I95: 0 | J95: 27 | K95: 59 | L95: =B94+H94+I94+J94+K94 -> 146 | M95: =C94+D94 -> 5 | N95: =E94+F94 -> 81
A96: MÉDIA TREINAMENTO | C96: =AVERAGE(C82:C94) -> 2.5384615384615383 | D96: =AVERAGE(D82:D94) -> 5.7692307692307692 | E96: =AVERAGE(E82:E94) -> 46.07692307692308 | F96: =AVERAGE(F82:F94) -> 29.384615384615383 | H96: 0 | I96: =AVERAGE(I82:I94) -> 0.84615384615384615 | J96: =AVERAGE(J82:J94) -> 30 | K96: =AVERAGE(K82:K94) -> 52.92307692307692 | M96: =AVERAGE(M82:M94) -> 8.3076923076923084 | N96: =AVERAGE(N82:N94) -> 75.461538461538467
G97: =SUM(B96:F96) ->  | M97: =C96+D96 ->  | N97: =E96+F96 -> 
A98: DATAMACE DE FORMA GERAL | B98: 58 | C98: 0 | D98: 3 | E98: 62 | F98: 23 | G98: =SUM(B96:F96) -> 146 | M98: =C96+D96 -> 3 | N98: =E96+F96 -> 85

A1: Corporativo
A2: Home
A3: S.A.D
A4: Mapa do site
A5: Organograma
A6: Assistência Médica
A7: Dados da Empresa
A8: Aniversários
A9: Pontes e Feriados
A10: Tô com fome
A11: Manutenção
A12: Escolaridade
A13: Representantes
A14: Suporte
A15: Informações sobre vírus
A16: Colaboradores
A17: Saúde e Qualidade de vida
A18: Eventos Datamace

A1: Estrutura
A2: Rede
A3: nº micros

A1: Apoio
A2: E-mails
A3: Links
A4: Ramais
A5: Telefones úteis

A1: Entretenimento
A2: Videoteca
A3: Biblioteca
A4: Enquetes
A5: Mural de anúncios

A1: Treinamento
A2: Portal

A1: Intersystem
A2: Compromisso
A3: Dados da empresa
A4: Missão
A5: Serviços